title,authors,description
Getting Results with Curriculum Mapping,Heidi Hayes Jacobs,"Curriculum maps are among the simplest yet most effective tools for improving teaching and learning. Because they require people to draw explicit connections between content, skills, and assessment measures, these maps help ensure that all aspects of a lesson are aligned not only with each other, but also with mandated standards and tests. In Getting Results with Curriculum Mapping, Heidi Hayes Jacobs and her coauthors offer a wide range of perspectives on how to get the most out of the curriculum mapping process in districts and schools. In addition to detailed examples of maps from schools across the United States, the authors offer concrete advice on such critical issues as * Preparing educators to implement mapping procedures, * Using software to create unique mapping databases, * Integrating decision-making structures and staff development initiatives through mapping, * Helping school communities adjust to new curriculum review processes, and * Making mapping an integral part of literacy training. Teachers, administrators, staff developers, and policymakers alike will find this book an essential guide to curriculum mapping and a vital resource for spearheading school improvement efforts. Note: This product listing is for the Adobe Acrobat (PDF) version of the book."
There's Always Enough: The Miraculous Move of God in Mozambique,Rolland Baker/Heidi Baker,"Even the most desperate poverty, the most devastating illness, the most heart-wrenching grief is not beyond God's help. His love and power have no limits-and that's a message readers from all walks of life need to hear. The modern miracles that Rolland and Heidi Baker experience every day in their work with Mozambique's throwaway children, movingly chronicled in Always Enough, will inspire anyone looking for hope in the midst of suffering. The Bakers, formerly missionaries in Indonesia and Hong Kong, share how their work for the past eight years in Mozambique, one of the poorest nations on earth, has borne spiritual fruit beyond their wildest dreams. Every day presents multiple impossible needs. But in the face of everything Satan can do, as Rolland and Heidi lay down their lives and ""minister to the one,"" there is always enough. Readers will discover that the simple practice of choosing to step out and trust God every day unleashes his provision for every need."
What to Expect the First Year (What to Expect),Heidi Murkoff/Sharon Mazel/Arlene Eisenberg/Sandee Hathaway/Mark D. Widome,"Some things about babies, happily, will never change. They still arrive warm, cuddly, soft, and smelling impossibly sweet. But how moms and dads care for their brand-new bundles of baby joy has changed—and now, so has the new-baby bible. Announcing the completely revised third edition of What to Expect the First Year. With over 10.5 million copies in print, First Year is the world’s best-selling, best-loved guide to the instructions that babies don’t come with, but should. And now, it’s better than ever. Every parent’s must-have/go-to is completely updated. Keeping the trademark month-by-month format that allows parents to take the potentially overwhelming first year one step at a time, First Year is easier-to-read, faster-to-flip-through, and new-family-friendlier than ever—packed with even more practical tips, realistic advice, and relatable, accessible information than before. Illustrations are new, too. Among the changes: Baby care fundamentals—crib and sleep safety, feeding, vitamin supplements—are revised to reflect the most recent guidelines. Breastfeeding gets more coverage, too, from getting started to keeping it going. Hot-button topics and trends are tackled: attachment parenting, sleep training, early potty learning (elimination communication), baby-led weaning, and green parenting (from cloth diapers to non-toxic furniture). An all-new chapter on buying for baby helps parents navigate through today’s dizzying gamut of baby products, nursery items, and gear. Also new: tips on preparing homemade baby food, the latest recommendations on starting solids, research on the impact of screen time (TVs, tablets, apps, computers), and “For Parents” boxes that focus on mom’s and dad’s needs. Throughout, topics are organized more intuitively than ever, for the best user experience possible."
The Player's Handbook: The Ultimate Guide on Dating and Relationships,Heidi Fleiss/Libby Keatinge,"Well-versed in the intricacies of the male psyche, the infamous Hollywood Madam offers time-tested strategies and hard-won wisdom on how to survive the love-go-round and come out on top."
Simply Beautiful Beading: 53 Quick and Easy Projects,Heidi Boyd,"Blend your creative spirit with the quick and easy projects found inside Simply Beautiful Beading From casual to sophisticated, and everything in between, you'll find beading designs to fit your personal style. Inside, you'll discover 53 simple yet stylish beading projects for exquisite jewelry, accessories and home decor, including: • modern glass bead chokers • semiprecious stone set • charm bracelets • wired-pearl barrettes • wineglass charms • hanging votive candle holder • and more than 35 variation projects for even more simply beautiful ideas!"
God Emperor of Dune (Dune Chronicles  #4),Frank Herbert,"Book Three in the Magnificent Dune Chronicles—the Bestselling Science Fiction Adventure of All Time The Children of Dune are twin siblings Leto and Ghanima Atreides, whose father, the Emperor Paul Muad’Dib, disappeared in the desert wastelands of Arrakis nine years ago. Like their father, the twins possess supernormal abilities—making them valuable to their manipulative aunt Alia, who rules the Empire in the name of House Atreides. Facing treason and rebellion on two fronts, Alia’s rule is not absolute. The displaced House Corrino is plotting to regain the throne while the fanatical Fremen are being provoked into open revolt by the enigmatic figure known only as The Preacher. Alia believes that by obtaining the secrets of the twins’ prophetic visions, she can maintain control over her dynasty. But Leto and Ghanima have their own plans for their visions—and their destinies...."
Chapterhouse: Dune (Dune Chronicles #6),Frank Herbert,"An all-new novel set in the universe of Star Trek: The Next Generation, in which tensions escalate between two powerful forces in interstellar space. The Venette Convention has always remained independent, but it is about to become the flashpoint for a tense military standoff between the two power blocs now dominating interstellar space—the United Federation of Planets and the recently formed Typhon Pact. The Venetan government turns to the Typhon Pact’s Tzenkethi Coalition for protection in the new order and has agreed to allow three of their supply bases for Tzenkethi use. But these bases—if militarized—would put Tzenkethi weapons unacceptably close to Federation, Cardassian, and Ferengi space. While Captain Ezri Dax and the crew of the U.S.S. Aventine are sent to investigate exactly what is happening at one of the Venette bases, Captain Jean-Luc Picard and the U.S.S. Enterprise are assigned to a diplomatic mission sent to the Venette homeworld in order to broker a mutually acceptable resolution. But the Cardassian delegates don’t seem particularly keen on using diplomacy to resolve the situation, which soon spirals out of control toward all-out war..."
Dune Messiah (Dune Chronicles #2),Frank Herbert,"Book Two in the Magnificent Dune Chronicles—the Bestselling Science Fiction Adventure of All Time Dune Messiah continues the story of Paul Atreides, better known—and feared—as the man christened Muad’Dib. As Emperor of the known universe, he possesses more power than a single man was ever meant to wield. Worshipped as a religious icon by the fanatical Fremen, Paul faces the enmity of the political houses he displaced when he assumed the throne—and a conspiracy conducted within his own sphere of influence. And even as House Atreides begins to crumble around him from the machinations of his enemies, the true threat to Paul comes to his lover, Chani, and the unborn heir to his family’s dynasty..."
Dreamer of Dune: The Biography of Frank Herbert,Brian Herbert,"Everyone knows Frank Herbert's Dune. This science fiction epic combines politics human evolution and ecology and has captured the imagination of generations of readers. It is one of the most popular science fiction novels ever written, has won awards, sold millions of copies around the world and spawned multiple motion-picture adaptations. Brian Herbert, Frank Herbert's eldest son, tells the provocative story of his father's extraordinary life in this honest and loving chronicle. He has also brought to light all the events in Herbert's life that would find their way into speculative fiction's greatest epic. From his early years in Tacoma, Washington, through his time at university and in the Navy, to the difficult years of poverty while struggling to become a published writer, Herbert worked long and hard before finding success after the publication of Dune in 1965. Brian Herbert writes about these years with a truthful intensity that brings every facet of his father's brilliant, and sometimes troubled, genius to full light. Insightful and provocative, this absorbing biography offers Brian Herbert's unique personal perspective on one of the most enigmatic and creative talents of our time."
Heretics of Dune (Dune Chronicles  #5),Frank Herbert,"Book Four in the Magnificent Dune Chronicles—the Bestselling Science Fiction Adventure of All Time Millennia have passed on Arrakis, and the once-desert planet is green with life. Leto Atreides, the son of the world’s savior, the Emperor Paul Muad’Dib, is still alive but far from human. To preserve humanity’s future, he sacrificed his own by merging with a sandworm, granting him near immortality as God Emperor of Dune for the past thirty-five hundred years. Leto’s rule is not a benevolent one. His transformation has made not only his appearance but his morality inhuman. A rebellion, led by Siona, a member of the Atreides family, has risen to oppose the despot’s rule. But Siona is unaware that Leto’s vision of a Golden Path for humanity requires her to fulfill a destiny she never wanted—or could possibly conceive...."
The Road to Dune,Frank Herbert/Brian Herbert/Kevin J. Anderson,"This companion to Frank Herbert's ""New York Times"" bestselling classic includes never-before-published chapters from ""Dune"" and ""Dune Messiah,"" original stories, and a brand-new novel by Brian Herbert and Kevin J. Anderson."
Heretics of Dune (Dune Chronicles #5),Frank Herbert,"Book Four in the Magnificent Dune Chronicles—the Bestselling Science Fiction Adventure of All Time Millennia have passed on Arrakis, and the once-desert planet is green with life. Leto Atreides, the son of the world’s savior, the Emperor Paul Muad’Dib, is still alive but far from human. To preserve humanity’s future, he sacrificed his own by merging with a sandworm, granting him near immortality as God Emperor of Dune for the past thirty-five hundred years. Leto’s rule is not a benevolent one. His transformation has made not only his appearance but his morality inhuman. A rebellion, led by Siona, a member of the Atreides family, has risen to oppose the despot’s rule. But Siona is unaware that Leto’s vision of a Golden Path for humanity requires her to fulfill a destiny she never wanted—or could possibly conceive...."
The Lord of the Rings: The Art of the Fellowship of the Ring,Gary Russell,"Contains five hundred exclusive images, including pencil sketches and conceptual drawings, which helped shape the film ""The Fellowship of the Ring."""
The Power of One (The Power of One  #1),Bryce Courtenay,"Tandia sat waiting anxiously for the fight to begin between the man she loved the most and the man she hated the most in the world. Tandia is a child of Africa: half Indian, half African, beautiful and intelligent, she is only sixteen when she is first brutalised by the police. Her fear of the white man leads her to join the black resistance movement, where she trains as a terrorist. With her in the fight for justice is the one white man Tandia can trust, the welterweight champion of the world, Peekay. Now he must fight their common enemy in order to save both their lives. 'This is a marvellous book ... first and foremost it is a momentous story, for Bryce Courtenay is a glorious storyteller.' The Advertiser 'Nine hundred pages of sheer blockbuster pleasure.' Sunday Age"
The Power of One (The Power of One  #1),Bryce Courtenay,"Tandia sat waiting anxiously for the fight to begin between the man she loved the most and the man she hated the most in the world. Tandia is a child of Africa: half Indian, half African, beautiful and intelligent, she is only sixteen when she is first brutalised by the police. Her fear of the white man leads her to join the black resistance movement, where she trains as a terrorist. With her in the fight for justice is the one white man Tandia can trust, the welterweight champion of the world, Peekay. Now he must fight their common enemy in order to save both their lives. 'This is a marvellous book ... first and foremost it is a momentous story, for Bryce Courtenay is a glorious storyteller.' The Advertiser 'Nine hundred pages of sheer blockbuster pleasure.' Sunday Age"
The Power of One: One Person  One Rule  One Month,John C. Maxwell/Stephen R. Graves/Thomas G. Addington,"Being a teenager in today's world is a trying time for a young Christian's heart, mind and faith. Ron Luce helps teens know that they are not alone, by encouraging them to stand up and be counted among the faithful. Topics included are: Standing up to peer pressure Standing up to your friends Standing up for purity Standing up at work The Power of One has the bold answers to the hard questions teens have to face. It's about the most basic part of being a Christian--Standing Up for what you believe. Once you can Stand Up, you're ready to start walking wherever Jesus wantes to lead you."
Power of an Hour: Business and Life Mastery in One Hour a Week,Dave Lakhani,"Praise for The Power of an Hour ""The master at getting what you want from others now tells us how to get what we want from ourselves! This is really a great book, and I recommend it highly-for you, for your team, and for your children."" -Bob Burg, author, Endless Referrals ""If you want to make predictable, systematic change in your life or your business, buy this book. Each chapter is a stand-alone system that results in powerful change . . . fast."" -David Hancock, The Entrepreneurial Publisher, CEO, Morgan James Publishing ""Dave's methods helped me take my business from $0 to $10 million in sales.If you're a creative business owner who wants total focus and massive success, run, don't walk, and get this book!"" -Stephanie Frank, author, The Accidental Millionaire ""The Power of an Hour is a mighty powerful way to sort out your financesby first sorting out yourself!"" -Mark Joyner, #1 bestselling author, The Irresistible Offer ""The disease of the twenty-first century, no matter who you are or what you do,is Time Deficit Disorder. Dave Lakhani offers a brilliant solution in this book.Get it and take the cure-you'll be surprised how much better you feel!"" -David Garfinkel, author, Customers on Demand"
The Power of One: The Solo Play for Playwrights  Actors  and Directors,Louis E. Catron,"This book demonstrates techniques of writing, acting, and directing that encourage the reader to create a personal theatrical experience."
How to Buy  Sell & Profit on eBay: Kick-Start Your Home-Based Business in Just Thirty Days,Adam Ginsberg,"Owning your own business may sound like paradise, but being the owner also means taking the responsibility for the business's health."
eBay for Dummies,Marsha Collier,"The bestsellng guide to successfully buying and selling on eBay, fully revised and updated eBay is the world's #1 shopping and selling site, where millions find bargains and make money with their own sales. Marsha Collier is the #1 eBay expert and bestselling author, with more than a million copies of her books in print. And eBay For Dummies has been the bestselling book on eBay since the original edition in 1999. Thoroughly updated to cover all the changes in the eBay site, eBay For Dummies, 6th Edition gets you started with information about signing up and navigating the site. It shows you how to find the best bargains, bid to win, and complete your purchase securely. Then it guides you into become a successful eBay seller, showing you how you can pick up extra money in a tight economy with eBay sales. Covers how to find bargains on eBay, bid successfully, and pay for your purchases safely Helps new users become comfortable with the site and shop with confidence Shows you how to set up a seller account, list items, offer customer service, ship merchandise, and receive payment securely Prepares you for other issues that may arise Explores eBay's special features, showing you how to work within the rules, use the community, and even set up a charity auction Includes insider tips on becoming a better buyer and seller eBay For Dummies, 6th Edition prepares you to save money on your purchases and make money on your sales, all from the comfort of your home."
What to Sell on ebay and Where to Get It: The Definitive Guide to Product Sourcing for eBay and Beyond,Chris Malta/Lisa Suttora,"If you want to build a profitable--and consistent--eBay business, you need to start with strategic product sourcing. What to Sell on eBay and Where to Get It reveals the same techniques used by the most successful e-commerce entrepreneurs and by major retail chains to determine what products will sell well and which suppliers will deliver those products for the best price. Learn to generate product ideas, research your markets, diversify your product line, and build a direct supply of inventory. Using the proven strategies in this book, you’ll be able to find the products that will fuel your business for the long term and skyrocket your sales!"
Starting an eBay Business for Dummies,Marsha Collier,"The bestsellng guide to successfully buying and selling on eBay, fully revised and updated eBay is the world's #1 shopping and selling site, where millions find bargains and make money with their own sales. Marsha Collier is the #1 eBay expert and bestselling author, with more than a million copies of her books in print. And eBay For Dummies has been the bestselling book on eBay since the original edition in 1999. Thoroughly updated to cover all the changes in the eBay site, eBay For Dummies, 6th Edition gets you started with information about signing up and navigating the site. It shows you how to find the best bargains, bid to win, and complete your purchase securely. Then it guides you into become a successful eBay seller, showing you how you can pick up extra money in a tight economy with eBay sales. Covers how to find bargains on eBay, bid successfully, and pay for your purchases safely Helps new users become comfortable with the site and shop with confidence Shows you how to set up a seller account, list items, offer customer service, ship merchandise, and receive payment securely Prepares you for other issues that may arise Explores eBay's special features, showing you how to work within the rules, use the community, and even set up a charity auction Includes insider tips on becoming a better buyer and seller eBay For Dummies, 6th Edition prepares you to save money on your purchases and make money on your sales, all from the comfort of your home."
eBay: Top 100 Simplified Tips & Tricks,Julia Wilkinson,"Providing adventurous users with 100 useful and surprising techniques, this book is the ideal resource to help readers become even more profitable users of eBay, the world's largest online marketplace. Organized into ten chapters, with ten tasks per chapter, this book provides the timesaving tips, cool secrets, and insider tricks to help take readers' knowledge of eBay beyond the basics. Readers discover how to take better pictures to help sell items, write stellar marketing copy to get those items sold faster and decrease questions from bidders, and find out the best time to start and end an auction to guarantee success."
ebay Timesaving Techniques for Dummies,Marsha Collier,"So, you’ve gotten started on eBay. You’ve made a few purchases and your first sale. You may have even built a moneymaking business. Now you’re looking for ways to ratchet things up. You’re looking for the insider tips and tricks for the easiest ways to take care of listing items, completing transactions, and keeping good records and you don't have the time to do all the research. eBay Timesaving Techniques For Dummies is the book for you. Marsha Collier, an eBay University instructor and best selling author of eBay For Dummies and Starting an eBay Business For Dummies, has collected the fastest and most effective techniques for finding items to sell, setting up your sales pages, pricing items to move, getting the word out about your business, collecting payments, shipping your item, and taking care of all the paperwork. Time is money after all. So why waste time when you can be making money on eBay. This book contains over 60 step-by-step techniques proven to add efficiency to your eBay operation. Includes coverage of: Finding sources for merchandise to sell on eBay Setting attractive prices and shipping costs Handling multiple sales without losing your cool Prettying up your auctions with digital photo and HTML tricks Tracking payments and shipments and keeping your customers happy Working with PayPal, both on and off of eBay Enhancing your status in the eBay community Simplifying your bookkeeping Creating marketing, merchandising, and advertising plans Solving problems quickly when they occur"
eBay Business All-in-One Desk Reference for Dummies,Marsha Collier,"The bestsellng guide to successfully buying and selling on eBay, fully revised and updated eBay is the world's #1 shopping and selling site, where millions find bargains and make money with their own sales. Marsha Collier is the #1 eBay expert and bestselling author, with more than a million copies of her books in print. And eBay For Dummies has been the bestselling book on eBay since the original edition in 1999. Thoroughly updated to cover all the changes in the eBay site, eBay For Dummies, 6th Edition gets you started with information about signing up and navigating the site. It shows you how to find the best bargains, bid to win, and complete your purchase securely. Then it guides you into become a successful eBay seller, showing you how you can pick up extra money in a tight economy with eBay sales. Covers how to find bargains on eBay, bid successfully, and pay for your purchases safely Helps new users become comfortable with the site and shop with confidence Shows you how to set up a seller account, list items, offer customer service, ship merchandise, and receive payment securely Prepares you for other issues that may arise Explores eBay's special features, showing you how to work within the rules, use the community, and even set up a charity auction Includes insider tips on becoming a better buyer and seller eBay For Dummies, 6th Edition prepares you to save money on your purchases and make money on your sales, all from the comfort of your home."
Ruby Cookbook,Lucas Carlson/Leonard Richardson,"Why spend time on coding problems that others have already solved when you could be making real progress on your Ruby project? This updated cookbook provides more than 350 recipes for solving common problems, on topics ranging from basic data structures, classes, and objects, to web development, distributed programming, and multithreading. Revised for Ruby 2.1, each recipe includes a discussion on why and how the solution works. You’ll find recipes suitable for all skill levels, from Ruby newbies to experts who need an occasional reference. With Ruby Cookbook, you’ll not only save time, but keep your brain percolating with new ideas as well. Recipes cover: Data structures including strings, numbers, date and time, arrays, hashes, files and directories Using Ruby’s code blocks, also known as closures OOP features such as classes, methods, objects, and modules XML and HTML, databases and persistence, and graphics and other formats Web development with Rails and Sinatra Internet services, web services, and distributed programming Software testing, debugging, packaging, and distributing Multitasking, multithreading, and extending Ruby with other languages"
Ruby Ann's Down Home Trailer Park Cookbook,Ruby Ann Boxcar,"Even those who live in a house without wheels can now share in the very special lifestyle afforded by the unique trailer park milieu. Ruby Ann shares her secrets for livin' life to the fullest along with anecdotes from the vaults of the High Chaparral trailer park where hot sex, warm spam and cold beer are just the beginning. With b/w photos throughout."
Ruby Ann's Down Home Trailer Park BBQin' Cookbook,Ruby Ann Boxcar,"Discusses techniques, tools, and terms of barbecue cooking, and offers trailer decoration advice and recipes for dishes including Baptist burgers, ambrosia pound cake, and Dr Pepper BBQ sauce."
