title,authors,description
The Salmon of Doubt (Dirk Gently  #3),Douglas Adams,"“A fitting eulogy to the master of wacky words and even wackier tales . . . Salmon leaves no doubt as to Adams’s lasting legacy.”—Entertainment Weekly With an introduction to the introduction by Terry Jones Douglas Adams changed the face of science fiction with his cosmically comic novel The Hitchhiker’s Guide to the Galaxy and its classic sequels. Sadly for his countless admirers, he hitched his own ride to the great beyond much too soon. Culled posthumously from Adams’s fleet of beloved Macintosh computers, this selection of essays, articles, anecdotes, and stories offers a fascinating and intimate portrait of the multifaceted artist and absurdist wordsmith. Join Adams on an excursion to climb Kilimanjaro . . . dressed in a rhino costume; peek into the private life of Genghis Khan—warrior and world-class neurotic; root for the harried author’s efforts to get a Hitchhiker movie off the ground in Hollywood; thrill to the further exploits of private eye Dirk Gently and two-headed alien Zaphod Beeblebrox. Though Douglas Adams is gone, he’s left us something very special to remember him by. Without a doubt. “Worth reading and even cherishing, if only because it’s the last we’ll hear from the master of comic science fiction.”—The Star-Ledger"
Wish You Were Here: The Official Biography of Douglas Adams,Nick  Webb,"“This amusing, sad, and heartfelt look at [Adams’s] lifeis a true gift.”—New York Post It all started when Douglas Adams demolished planet Earth in order to make way for an intergalactic expressway—and then invited everyone to thumb a ride on a comical cosmic road trip in The Hitchhiker’s Guide to the Galaxy. Adams made the universe a much funnier place to inhabit and forever changed the way we think about towels, extraterrestrial poetry, and especially the number 42. And then, too soon, he was gone. In Wish You Were Here, Nick Webb, a longtime friend of the author, reveals the many sides, quirks, and contradictions of Douglas Adams. A summation as celebration, it is a look back at a life well worth the vicarious reliving, as studded with anecdote, droll comic incident, and heartfelt insight as its subject’s own unforgettable tales of cosmic wanderlust. Praise for Wish You Were Here “Webb’s tale brims with affection and humour; every page is a delight.”—The Daily Mail “It’s perhaps the ultimate credit to Webb that he can be just as funny as Adams in his writing. With many of the same veins of humour that Adams had running throughout this biography, it’s as if the great hitchhiker has never really left.”—The Leeds Guide"
Douglas Adams's Starship Titanic,Terry Jones,"From the minds of Douglas Adams (The Hitchhiker's Guide to the Galaxy) and Terry Jones (Monty Python) comes Starship Titanic, the hilarious novelization of the third-best adventure game of 1999. Welcome on board the Starship Titanic. The Ship that Cannot Possibly Go Wrong. At the centre of the galaxy, a vast, unknown civilization is preparing for an event of epic proportions: the launch of the greatest, most gorgeous, most technologically advanced spaceship ever built – the Starship Titanic. An Earthling would see the ship as something really, really big, but rather less provincial onlookers would recognize it as the design of Leovinus, the galaxy’s most renowned architect. Before the launch Leovinus is having one last little look round and begins to find that things just aren’t right: poor workmanship, cybersystems out of control, robots walking into doors. How could this have happened? The following morning, while the galaxy’s media looks on, the fabulous ship eases away from the construction dock, picks up speed, sways a little, wobbles a bit, veers wildly and, just before it can do untold damage to everything around it, appears to undergo SMEF (Spontaneous Massive Existence Failure). In just ten seconds, the whole stupendous enterprise is over. And our story has just begun . . ."
Salmon of Doubt: Hitchhiking the Galaxy One Last Time,Douglas Adams/Christopher Cerf,"“A fitting eulogy to the master of wacky words and even wackier tales . . . Salmon leaves no doubt as to Adams’s lasting legacy.”—Entertainment Weekly With an introduction to the introduction by Terry Jones Douglas Adams changed the face of science fiction with his cosmically comic novel The Hitchhiker’s Guide to the Galaxy and its classic sequels. Sadly for his countless admirers, he hitched his own ride to the great beyond much too soon. Culled posthumously from Adams’s fleet of beloved Macintosh computers, this selection of essays, articles, anecdotes, and stories offers a fascinating and intimate portrait of the multifaceted artist and absurdist wordsmith. Join Adams on an excursion to climb Kilimanjaro . . . dressed in a rhino costume; peek into the private life of Genghis Khan—warrior and world-class neurotic; root for the harried author’s efforts to get a Hitchhiker movie off the ground in Hollywood; thrill to the further exploits of private eye Dirk Gently and two-headed alien Zaphod Beeblebrox. Though Douglas Adams is gone, he’s left us something very special to remember him by. Without a doubt. “Worth reading and even cherishing, if only because it’s the last we’ll hear from the master of comic science fiction.”—The Star-Ledger"
The Phantom Tollbooth: A Children's Play in Two Acts,Susan Nanus/Norton Juster,"Here are Milo’s adventures in the Land of Wisdom, where he’s forced to think about many new things. Milo learns of the argument between King Azaz and his brother, the Mathemagician, whose disagreement over words and numbers has led to the banishment of Princesses Sweet Rhyme and Pure Reason. Milo is dispatched to rescue the princesses from the Land of Ignorance. The knowledge and skills Milo picks up on his journey help him to save the princesses. When he must return home, Milo’s sorry to leave his friends – but enriched by his experience, he realizes his attitude toward learning will never be the same."
On Bullshit,Harry G. Frankfurt,"#1 New York Times bestseller Featured on The Daily Show and 60 Minutes The acclaimed book that illuminates our world and its politics by revealing why bullshit is more dangerous than lying One of the most prominent features of our world is that there is so much bullshit. Yet we have no clear understanding of what bullshit is, how it’s distinct from lying, what functions it serves, and what it means. In his acclaimed bestseller On Bullshit, Harry Frankfurt, who was one of the world’s most influential moral philosophers, explores this important subject, which has become a central problem of politics and our world. With his characteristic combination of philosophical acuity, psychological insight, and wry humor, Frankfurt argues that bullshitters misrepresent themselves to their audience not as liars do, that is, by deliberately making false claims about what is true. Rather, bullshitters seek to convey a certain impression of themselves without being concerned about whether anything at all is true. They quietly change the rules governing their end of the conversation so that claims about truth and falsity are irrelevant. Although bullshit can take many innocent forms, excessive indulgence in it can eventually undermine the bullshitter’s capacity to tell the truth in a way that lying does not. Liars at least acknowledge that the truth matters. Because of this, bullshit is a greater enemy of the truth than lies are. Remarkably prescient and insightful, On Bullshit is a small book that explains a great deal about our time."
Another Bullshit Night in Suck City,Nick Flynn,"The son of a convicted bank robber and con artist describes their complicated relationship, relating how his father, while in jail, sent the author letters throughout his childhood and turned up in a Boston homeless shelter where the author was a caseworker."
Lincoln at Gettysburg: The Words That Remade America,Garry Wills,Examination of the Gettysburg Address and Lincoln in their historical moment and cultural frame breathing new life into the words and revealing much about the President.
The Gettysburg Address,Abraham Lincoln/Michael McCurdy,"Is your child getting lost in the system, becoming bored, losing his or her natural eagerness to learn? If so, it may be time to take charge of your child’s education—by doing it yourself. The Well-Trained Mind will instruct you, step by step, on how to give your child an academically rigorous, comprehensive education from preschool through high school—one that will train him or her to read, to think, to understand, to be well-rounded and curious about learning. Veteran home educators Susan Wise Bauer and Jessie Wise outline the classical pattern of education called the trivium, which organizes learning around the maturing capacity of the child’s mind and comprises three stages: the elementary school “grammar stage,” when the building blocks of information are absorbed through memorization and rules; the middle school “logic stage,” in which the student begins to think more analytically; and the high-school “rhetoric stage,” where the student learns to write and speak with force and originality. Using this theory as your model, you’ll be able to instruct your child—whether full-time or as a supplement to classroom education—in all levels of reading, writing, history, geography, mathematics, science, foreign languages, rhetoric, logic, art, and music, regardless of your own aptitude in those subjects. Thousands of parents and teachers have already used the detailed book lists and methods described in The Well-Trained Mind to create a truly superior education for the children in their care. This extensively revised fourth edition contains completely updated curricula and book lists, links to an entirely new set of online resources, new material on teaching children with learning challenges, cutting-edge math and sciences recommendations, answers to common questions about home education, and advice on practical matters such as standardized testing, working with your local school board, designing a high-school program, preparing transcripts, and applying to colleges. You do have control over what and how your child learns. The Well-Trained Mind will give you the tools you’ll need to teach your child with confidence and success."
Underworld,Don DeLillo,"Finalist for the Pulitzer Prize Finalist for the National Book Award Finalist for the National Book Critics Circle Award Winner of the Howell’s Medal of the American Academy of Arts and Letters One of The New York Times Book Review’s 10 Best Books “A great American novel, a masterpiece, a thrilling page-turner.” —San Francisco Chronicle *With a new preface by Don DeLillo on the 25th anniversary of publication* Don DeLillo's mesmerizing novel was a major bestseller when it was published in 1997 and was the most widely reviewed novel of the year. It opens with a legendary baseball game played between the Brooklyn Dodgers and the New York Giants in 1951. The home run that won the game was called the Shot Heard Round the World, and was shadowed by the terrifying news that on the same day, Russia tested its first hydrogen bomb. Underworld then tells the story of Klara Sax and Nick Shay, and of a half century of American life during the Cold War and beyond. “A dazzling, phosphorescent work of art.” —Michiko Kakutani, The New York Times “This is a novel that draws together baseball, the Bomb, J. Edgar Hoover, waste disposal, drugs, gangs, Vietnam, fathers and sons, comic Lenny Bruce and the Cuban Missile Crisis. It also depicts passionate adultery, weapons testing, the care of aging mothers, the postwar Bronx, '60s civil rights demonstrations, advertising, graffiti artists at work, Catholic education, chess and murder. There's a viewing of a lost Eisenstein film, meditations on the Watts Tower, an evening at Truman Capote's Black & White Ball, a hot-air balloon ride, serial murders in Texas, a camping trip in the Southwest, a nun on the Internet, reflections on history, one hit (or possibly two) by the New York mob and an apparent miracle. As DeLillo says and proves, ‘Everything is connected in the end.’"" —Michael Dirda, The Washington Post Book World “Underworld is an amazing performance, a novel that encompasses some five decades of history, both the hard, bright world of public events and the more subterranean world of private emotions. It is the story of one man, one family, but it is also the story of what happened to America in the second half of the 20th century.” —The New York Times “Astonishing…A benchmark of twentieth-century fiction, Underworld is stunningly beautiful in its generous humanity, locating the true power of history not in tyranny, collective political movements or history books, but inside each of us.” —Greg Burkman, The Seattle Times “It’s hard to imagine a way people might better understand American life in the second half of the twentieth century and beginning of the twenty-first than by reading Don DeLillo. The scale of his inquiry is global and historic… His work is astounding, made of stealthy blessings… it proves to my generation of writers that fiction can still do anything it wants.” —Jennifer Egan, in her presentation of the Medal for Distinguished Contribution to American Letters “Underworld is a page-turner and a masterwork, a sublime novel and a delight to read.” —Joan Mellen, The Baltimore Sun"
Libra,Don DeLillo,"From the author of the National Book Award-winning novel White Noise comes an eerily convincing fictional speculation on the events leading up to the assassination of John F. Kennedy In this powerful, unsettling novel, Don DeLillo chronicles Lee Harvey Oswald’s odyssey from troubled teenager to a man of precarious stability who imagines himself an agent of history. When “history” presents itself in the form of two disgruntled CIA operatives who decide that an unsuccessful attempt on the life of the president will galvanize the nation against communism, the scales are irrevocably tipped. A gripping, masterful blend of fact and fiction, alive with meticulously portrayed characters both real and created, Libra is a grave, haunting, and brilliant examination of an event that has become an indelible part of the American psyche."
Americana,Don DeLillo,"“DeLillo’s swift, ironic, and witty cross-country American nightmare doesn't have a dull or an unoriginal line.”—Rolling Stone The first novel by Don DeLillo, author of White Noise (winner of the National Book Award) and The Silence At twenty-eight, David Bell is the American Dream come true. He has fought his way to the top, surviving office purges and scandals to become a top television executive. David’s world is made up of the images that flicker across America’s screens, the fantasies that enthrall America's imagination. When, at the height of his success, the dream (and the dream-making) become a nightmare, David sets out to rediscover reality. Camera in hand, he journeys across the country in a mad and moving attempt to capture and to impose a pattern on America’s—and his own—past, present, and future."
Running Dog,Don DeLillo,"Moll Robbins is a journalist in a rut. But she gets wind of a very exciting story: it concerns a small piece of celluloid, a pornographic film purportedly shot in a bunker in the climactic days of Berlin's fall – with Hitler as its star. One person claims to have access to this unique piece of Naziana; inevitably, more than one want it. Unfortunately for Moll, in the black-market world of erotica, the currency is blackmail, torture and corruption; and no price is too high. As the paranoia builds and the combatants lose sight of their motives, their souls, even the object itself, Don DeLillo reveals the terrible truth behind our acquisitiveness in Running Dog – a masterful thriller from an award-winning novelist."
Cosmopolis,Don DeLillo,"Eric Packer, a young billionaire asset manager, journeys across New York in his limousine despite a threat against his life, and the occurances of various events that are stalling traffic throughout the city."
Great Jones Street,Don DeLillo,"From the author of White Noise (winner of the National Book Award) and The Silence, a novel that “reflects our era’s nightmares and hallucinations with all appropriate lurid, tawdry shades” (The Cleveland Plain Dealer) Bucky Wunderlick, rock star and budding messiah, has hit a spiritual wall. Unfulfilled by the excess of fame and fortune his revolutionary image has wrought, he bolts from his band mid-tour to hole up in a dingy East Village apartment and separate himself from the paranoid machine that propels the culture he has helped create. As faithful fans await messages, Bucky encounters every sort of roiling farce he is trying to escape. Great Jones Street is a penetrating look at rock and roll's merger of art, commerce and urban decay."
The Names,Don DeLillo,"DeLillo's seventh is an exotic thriller. Set mostly in Greece, it concerns a mysterious 'language cult' seemingly behind a number of unexplained murders. Obsessed by news of this ritualistic violence, an American risk analyst is drawn to search for an explanation. We follow his progress on an obsessive journey that begins to take over his life and the lives of those closest to him. In addition to offering a series of precise character studies, The Names explores the intersection of language and culture, the perception of America from both inside and outside of its borders, and the impact that narration has on the facts of a story. Meditative and probing, DeLillo wonders: how does one cope with the fact that the act of articulation is simultaneously capable of defining and circumscriptively restricting access to the self?"
Against the Day,Thomas Pynchon,"“[Pynchon's] funniest and arguably his most accessible novel.” —The New York Times Book Review “Raunchy, funny, digressive, brilliant.” —USA Today “Rich and sweeping, wild and thrilling.” —The Boston Globe Spanning the era between the Chicago World's Fair of 1893 and the years just after World War I, and constantly moving between locations across the globe (and to a few places not strictly speaking on the map at all), Against the Day unfolds with a phantasmagoria of characters that includes anarchists, balloonists, drug enthusiasts, mathematicians, mad scientists, shamans, spies, and hired guns. As an era of uncertainty comes crashing down around their ears and an unpredictable future commences, these folks are mostly just trying to pursue their lives. Sometimes they manage to catch up; sometimes it's their lives that pursue them."
V.,Thomas Pynchon,"""This work may well stand as one of the very best works of the century."" —Atlantic Review ""[A] brilliant and turbulent first novel."" —George Plimpton, New York Times Book Review The wild, macabre tale of the twentieth century and of two men—one looking for something he has lost, the other with nothing much to lose—and “V.,” the unknown woman of the title. Pynchon's debut novel follows discharged Navy sailor Benny Profane as he reconnects with an eclectic collection of artists in New York known as the ""Whole Sick Crew"" along with his sidekick Pig Bodine, and the plot of Herbert Stencil, looking to find the woman he knows only as she is described in his father's diary: ""V."" Brimming with madcap characters, the novel meanders from New York to Alexandria, Cairo, Paris, Florence, and Africa, and traverses generations. Time magazine raves, ""Few books haunt the waking or the sleeping mind, but this is one."""
The Crying of Lot 49,Thomas Pynchon,"One of The Atlantic’s Great American Novels of the Past 100 Years “The comedy crackles, the puns pop, the satire explodes.”—The New York Times “The work of a virtuoso with prose . . . His intricate symbolic order [is] akin to that of Joyce’s Ulysses.”—Chicago Tribune “A puzzle, an intrigue, a literary and historical tour de force.”—San Francsisco Examiner The highly original satire about Oedipa Maas, a woman who finds herself enmeshed in a worldwide conspiracy. When her ex-lover, wealthy real-estate tycoon Pierce Inverarity, dies and designates her the coexecutor of his estate, California housewife Oedipa Maas is thrust into a paranoid mystery of metaphors, symbols, and the United States Postal Service. Traveling across Southern California, she meets some extremely interesting characters, and attains a not inconsiderable amount of self-knowledge."
Gravity's Rainbow,Thomas Pynchon,"Winner of the 1974 National Book Award ""The most profound and accomplished American novel since the end of World War II."" - The New Republic “A screaming comes across the sky. . .” A few months after the Germans’ secret V-2 rocket bombs begin falling on London, British Intelligence discovers that a map of the city pinpointing the sexual conquests of one Lieutenant Tyrone Slothrop, U.S. Army, corresponds identically to a map showing the V-2 impact sites. The implications of this discovery will launch Slothrop on an amazing journey across war-torn Europe, fleeing an international cabal of military-industrial superpowers, in search of the mysterious Rocket 00000."
Mason & Dixon,Thomas Pynchon/Christophe Claro/Brice Matthieussent,"George Mason (1725-92) is often omitted from the small circle of founding fathers celebrated today, but in his service to America he was, in the words of Thomas Jefferson, ""of the first order of greatness."" Jeff Broadwater provides a comprehensive account of Mason's life at the center of the momentous events of eighteenth-century America. Mason played a key role in the Stamp Act Crisis, the American Revolution, and the drafting of Virginia's first state constitution. He is perhaps best known as author of the Virginia Declaration of Rights, a document often hailed as the model for the Bill of Rights. As a Virginia delegate to the Constitutional Convention in Philadelphia, Mason influenced the emerging Constitution on point after point. Yet when he was rebuffed in his efforts to add a bill of rights and concluded the document did too little to protect the interests of the South, he refused to sign the final draft. Broadwater argues that Mason's recalcitrance was not the act of an isolated dissenter; rather, it emerged from the ideology of the American Revolution. Mason's concerns about the abuse of political power, Broadwater shows, went to the essence of the American experience."
Vineland,Thomas Pynchon,"Vineland, a zone of blessed anarchy in northern California, is the last refuge of hippiedom, a culture devastated by the sobriety epidemic, Reaganomics, and the Tube. Here, in an Orwellian 1984, Zoyd Wheeler and his daughter Prairie search for Prairie's long-lost mother, a Sixties radical who ran off with a narc. Vineland is vintage Pynchon, full of quasi-allegorical characters, elaborate unresolved subplots, corny songs (""Floozy with an Uzi""), movie spoofs (Pee-wee Herman in The Robert Musil Story), and illicit sex (including a macho variation on the infamous sportscar scene in V.). For more than seventy years, Penguin has been the leading publisher of classic literature in the English-speaking world. With more than 1,700 titles, Penguin Classics represents a global bookshelf of the best works throughout history and across genres and disciplines. Readers trust the series to provide authoritative texts enhanced by introductions and notes by distinguished scholars and contemporary authors, as well as up-to-date translations by award-winning translators."
Gravity's Rainbow,Thomas Pynchon,"Winner of the 1974 National Book Award ""The most profound and accomplished American novel since the end of World War II."" - The New Republic “A screaming comes across the sky. . .” A few months after the Germans’ secret V-2 rocket bombs begin falling on London, British Intelligence discovers that a map of the city pinpointing the sexual conquests of one Lieutenant Tyrone Slothrop, U.S. Army, corresponds identically to a map showing the V-2 impact sites. The implications of this discovery will launch Slothrop on an amazing journey across war-torn Europe, fleeing an international cabal of military-industrial superpowers, in search of the mysterious Rocket 00000."
Slow Learner: Early Stories,Thomas Pynchon,"""An exhilarating spectacle of greatness discovering its powers."" - New Republic ""Funny and wise enough to charm the gravity from a rainbow...All five of the pieces have unusual narrative vigor and inventiveness."" - New York Times Compiling five short stories originally written between 1959 and 1964, Slow Learner showcases Thomas Pynchon’s writing before the publication of his first novel V. The stories compiled here are “The Small Rain,” “Low-lands,” “Entropy,” “Under the Rose,” and “The Secret Integration,” along with an introduction by Pynchon himself that Time magazine calls his ""first public gesture toward autobiography."""
