title,authors,description
Harry Potter and the Half-Blood Prince (Harry Potter  #6),J.K. Rowling/Mary GrandPré,"There it was, hanging in the sky above the school: the blazing green skull with a serpent tongue, the mark Death Eaters left behind whenever they had entered a building... wherever they had murdered... When Dumbledore arrives at Privet Drive one summer night to collect Harry Potter, his wand hand is blackened and shrivelled, but he does not reveal why. Secrets and suspicion are spreading through the wizarding world, and Hogwarts itself is not safe. Harry is convinced that Malfoy bears the Dark Mark: there is a Death Eater amongst them. Harry will need powerful magic and true friends as he explores Voldemort's darkest secrets, and Dumbledore prepares him to face his destiny... Having become classics of our time, the Harry Potter eBooks never fail to bring comfort and escapism. With their message of hope, belonging and the enduring power of truth and love, the story of the Boy Who Lived continues to delight generations of new readers."
Harry Potter and the Order of the Phoenix (Harry Potter  #5),J.K. Rowling/Mary GrandPré,"The fifth book in the Harry Potter series, now in a special edition paperback with colorful stenciled edges! A must-have collectible for fans and a beautiful gift for book lovers of all ages. There is a door at the end of a silent corridor. And it's haunting Harry Potter's dreams. Why else would he be waking in the middle of the night, screaming in terror? It's not just the upcoming O.W.L. exams; a new teacher with a personality like poisoned honey; a disgruntled house-elf; or even the growing threat of He-Who-Must-Not-Be-Named. Now Harry Potter is faced with the unreliability of the very government of the magical world and the impotence of the authorities at Hogwarts. Despite this (or perhaps because of it), he finds depth and strength in his friends beyond what even he knew, boundless loyalty, and unbearable sacrifice."
Harry Potter and the Chamber of Secrets (Harry Potter  #2),J.K. Rowling,"In Harry Potter and the Chamber of Secrets, the summer after Harry’s first year at Hogwarts has been his worst summer ever… the Dursleys more distant and horrible than ever before. But just as he’s packing his bags to return to school, a creature named Dobby the house-elf announces that if Harry goes back to Hogwarts, disaster will strike. And it turns out, Dobby is right. Harry and Ron miss the Hogwarts Express, so they fly to school in a blue Ford Anglia, crash landing in the notorious Whomping Willow. Soon other worries accumulate: the outrageously stuck-up new professor Gilderoy Lockhart; a ghost named Moaning Myrtle, who haunts the girls' bathroom; the strange behavior of Ron's little sister, Ginny Weasley; rumors about the ""Chamber of Secrets,"" a cavern buried deep below Hogwarts; and a magical diary owned by Tom Riddle, a Hogwarts student of long ago. Harry is also shocked to discover that he can speak Parseltongue, the language of snakes - a rare ability that Lord Voldemort also possessed - and that anti-Muggle prejudice exists in the Wizarding world, even affecting Harry's friend Hermione. But all of these seem like minor concerns when someone starts turning Hogwarts students to stone: an evildoer said to be the fearsome Heir of Salazar Slytherin, on of the founders of the school. Could it be Draco Malfoy, Harry's most poisonous rival? Could it be Hagrid whose mysterious past is finally told? Or could it be the one person everyone at Hogwarts most suspects: Harry Potter himself?"
Harry Potter and the Prisoner of Azkaban (Harry Potter  #3),J.K. Rowling/Mary GrandPré,"'Welcome to the Knight Bus, emergency transport for the stranded witch or wizard. Just stick out your wand hand, step on board and we can take you anywhere you want to go.' When the Knight Bus crashes through the darkness and screeches to a halt in front of him, it's the start of another far from ordinary year at Hogwarts for Harry Potter. Sirius Black, escaped mass-murderer and follower of Lord Voldemort, is on the run - and they say he is coming after Harry. In his first ever Divination class, Professor Trelawney sees an omen of death in Harry's tea leaves... But perhaps most terrifying of all are the Dementors patrolling the school grounds, with their soul-sucking kiss... Having become classics of our time, the Harry Potter eBooks never fail to bring comfort and escapism. With their message of hope, belonging and the enduring power of truth and love, the story of the Boy Who Lived continues to delight generations of new readers."
Harry Potter Boxed Set  Books 1-5 (Harry Potter  #1-5),J.K. Rowling/Mary GrandPré,"When the Quidditch World Cup is disrupted by Voldemort's rampaging supporters alongside the resurrection of the terrifying Dark Mark, it is obvious to Harry Potter that, far from weakening, Voldemort is getting stronger. Back at Hogwarts for his fourth year, Harry is astonished to be chosen by the Goblet of Fire to represent the school in the Triwizard Tournament. The competition is dangerous, the tasks terrifying, and true courage is no guarantee of survival - especially when the darkest forces are on the rise.These adult editions with glorious jacket art by Andrew Davidson are now available in hardback for the first time."
"Unauthorized Harry Potter Book Seven News: ""Half-Blood Prince"" Analysis and Speculation",W. Frederick Zimmerman,"In The End of Harry Potter?, David Langford—Potter fan and award-winning writer—examines the many mysteries that remained unsolved prior to publication of the final volume of J. K. Rowling's magical series. The publication of Harry Potter and the Deathly Hallows, the seventh and final Harry Potter novel, was one of the most eagerly anticipated events in the history of publishing. Even the smallest hints from the author about what may happen to Harry and his friends generated major news stories. Is Albus Dumbledore really dead? Whose side is Severus Snape really on? What are the remaining horcruxes, where He Who Shall Not Be Named has stashed his soul? Does Harry bear a part of the Dark Lord's soul in his scar, and is this why he understands Parseltongue? In this highly entertaining book, Langford uses his deep knowledge of the six published Harry Potter novels to explore these and other mysteries, and to present a selection of possible outcomes. While Harry Potter and the Deathly Hallows may lay these questions to rest, Potter fans will still find David Langford's book enchanting and thought-provoking, and a perfect way to refresh their memory of the first six books in this beloved series. At the Publisher's request, this title is being sold without Digital Rights Management Software (DRM) applied."
Harry Potter Collection (Harry Potter  #1-6),J.K. Rowling,"Discover the wands of your favorite Harry Potter characters. In the Harry Potter films, each wand is as unique as the witch or wizard who wields it. From Hermione Granger’s elegant, vine-wrapped wand to the bone-inlaid wands of the Death Eaters, each was designed and crafted by the filmmakers to reflect its owner’s identity. Harry Potter: The Wand Collection is a visual guide to these magical wands, their makers, and the characters who mastered them. Profiles of each wand feature stunning new photography of the original props, wand statistics, insights from the cast and crew, and other filmmaking secrets from the Warner Bros. archive. This collectible volume is an ideal resource for both wand-wielding veteran fans seeking to learn the history behind these beloved items and a new generation just beginning their journey into the wizarding world."
The Ultimate Hitchhiker's Guide: Five Complete Novels and One Story (Hitchhiker's Guide to the Galaxy  #1-5),Douglas Adams,"In one complete volume, here are the five classic novels from Douglas Adams’s beloved Hitchhiker series. Now celebrating the pivotal 42nd anniversary of The Hitchhiker’s Guide to the Galaxy, soon to be a Hulu original series! The Hitchhiker’s Guide to the Galaxy (Nominated as one of America’s best-loved novels by PBS’s The Great American Read) Seconds before the Earth is demolished for a galactic freeway, Arthur Dent is saved by Ford Prefect, a researcher for the revised Guide. Together they stick out their thumbs to the stars and begin a wild journey through time and space. The Restaurant at the End of the Universe The moment before annihilation at the hands of warmongers is a curious time to crave tea. It could only happen to the cosmically displaced Arthur Dent and his comrades as they hurtle across the galaxy in a desperate search for a place to eat. Life, the Universe and Everything The unhappy inhabitants of planet Krikkit are sick of looking at the night sky– so they plan to destroy it. The universe, that is. Now only five individuals can avert Armageddon: mild-mannered Arthur Dent and his stalwart crew. So Long, and Thanks for All the Fish Back on Earth, Arthur Dent is ready to believe that the past eight years were all just a figment of his stressed-out imagination. But a gift-wrapped fishbowl with a cryptic inscription thrusts him back to reality. So to speak. Mostly Harmless Just when Arthur Dent makes the terrible mistake of starting to enjoy life, all hell breaks loose. Can he save the Earth from total obliteration? Can he save the Guide from a hostile alien takeover? Can he save his daughter from herself? Includes the bonus story “Young Zaphod Plays It Safe” “With droll wit, a keen eye for detail and heavy doses of insight . . . Adams makes us laugh until we cry.”—San Diego Union-Tribune “Lively, sharply satirical, brilliantly written . . . ranks with the best set pieces in Mark Twain.”—The Atlantic"
The Ultimate Hitchhiker's Guide to the Galaxy (Hitchhiker's Guide to the Galaxy  #1-5),Douglas Adams,"In one complete volume, here are the five classic novels from Douglas Adams’s beloved Hitchhiker series. Now celebrating the pivotal 42nd anniversary of The Hitchhiker’s Guide to the Galaxy, soon to be a Hulu original series! The Hitchhiker’s Guide to the Galaxy (Nominated as one of America’s best-loved novels by PBS’s The Great American Read) Seconds before the Earth is demolished for a galactic freeway, Arthur Dent is saved by Ford Prefect, a researcher for the revised Guide. Together they stick out their thumbs to the stars and begin a wild journey through time and space. The Restaurant at the End of the Universe The moment before annihilation at the hands of warmongers is a curious time to crave tea. It could only happen to the cosmically displaced Arthur Dent and his comrades as they hurtle across the galaxy in a desperate search for a place to eat. Life, the Universe and Everything The unhappy inhabitants of planet Krikkit are sick of looking at the night sky– so they plan to destroy it. The universe, that is. Now only five individuals can avert Armageddon: mild-mannered Arthur Dent and his stalwart crew. So Long, and Thanks for All the Fish Back on Earth, Arthur Dent is ready to believe that the past eight years were all just a figment of his stressed-out imagination. But a gift-wrapped fishbowl with a cryptic inscription thrusts him back to reality. So to speak. Mostly Harmless Just when Arthur Dent makes the terrible mistake of starting to enjoy life, all hell breaks loose. Can he save the Earth from total obliteration? Can he save the Guide from a hostile alien takeover? Can he save his daughter from herself? Includes the bonus story “Young Zaphod Plays It Safe” “With droll wit, a keen eye for detail and heavy doses of insight . . . Adams makes us laugh until we cry.”—San Diego Union-Tribune “Lively, sharply satirical, brilliantly written . . . ranks with the best set pieces in Mark Twain.”—The Atlantic"
The Hitchhiker's Guide to the Galaxy (Hitchhiker's Guide to the Galaxy  #1),Douglas Adams,"The Hitchhiker's Guide to the Galaxy provides an excellent way of looking at some intriguing issues in philosophy, from vegetarianism and Artificial Intelligence to God, space and time. This is an entertaining yet thought provoking volume for students, philosophers and fans of The Hitchhiker's series."
The Hitchhiker's Guide to the Galaxy (Hitchhiker's Guide to the Galaxy  #1),Douglas Adams/Stephen Fry,"The Hitchhiker's Guide to the Galaxy provides an excellent way of looking at some intriguing issues in philosophy, from vegetarianism and Artificial Intelligence to God, space and time. This is an entertaining yet thought provoking volume for students, philosophers and fans of The Hitchhiker's series."
The Ultimate Hitchhiker's Guide (Hitchhiker's Guide to the Galaxy  #1-5),Douglas Adams,"In one complete volume, here are the five classic novels from Douglas Adams’s beloved Hitchhiker series. Now celebrating the pivotal 42nd anniversary of The Hitchhiker’s Guide to the Galaxy, soon to be a Hulu original series! The Hitchhiker’s Guide to the Galaxy (Nominated as one of America’s best-loved novels by PBS’s The Great American Read) Seconds before the Earth is demolished for a galactic freeway, Arthur Dent is saved by Ford Prefect, a researcher for the revised Guide. Together they stick out their thumbs to the stars and begin a wild journey through time and space. The Restaurant at the End of the Universe The moment before annihilation at the hands of warmongers is a curious time to crave tea. It could only happen to the cosmically displaced Arthur Dent and his comrades as they hurtle across the galaxy in a desperate search for a place to eat. Life, the Universe and Everything The unhappy inhabitants of planet Krikkit are sick of looking at the night sky– so they plan to destroy it. The universe, that is. Now only five individuals can avert Armageddon: mild-mannered Arthur Dent and his stalwart crew. So Long, and Thanks for All the Fish Back on Earth, Arthur Dent is ready to believe that the past eight years were all just a figment of his stressed-out imagination. But a gift-wrapped fishbowl with a cryptic inscription thrusts him back to reality. So to speak. Mostly Harmless Just when Arthur Dent makes the terrible mistake of starting to enjoy life, all hell breaks loose. Can he save the Earth from total obliteration? Can he save the Guide from a hostile alien takeover? Can he save his daughter from herself? Includes the bonus story “Young Zaphod Plays It Safe” “With droll wit, a keen eye for detail and heavy doses of insight . . . Adams makes us laugh until we cry.”—San Diego Union-Tribune “Lively, sharply satirical, brilliantly written . . . ranks with the best set pieces in Mark Twain.”—The Atlantic"
A Short History of Nearly Everything,Bill Bryson,"This new edition of the acclaimed bestseller is lavishly illustrated to convey, in pictures as in words, Bill Bryson’s exciting, informative journey into the world of science. In A Short History of Nearly Everything, the bestselling author of A Walk in the Woods and The Body, confronts his greatest challenge yet: to understand—and, if possible, answer—the oldest, biggest questions we have posed about the universe and ourselves. Taking as his territory everything from the Big Bang to the rise of civilization, Bryson seeks to understand how we got from there being nothing at all to there being us. The result is a sometimes profound, sometimes funny, and always supremely clear and entertaining adventure in the realms of human knowledge, as only Bill Bryson can render it. Now, in this handsome new edition, Bill Bryson’s words are supplemented by full-color artwork that explains in visual terms the concepts and wonder of science, at the same time giving face to the major players in the world of scientific study. Eloquently and entertainingly described, as well as richly illustrated, science has never been more involving or entertaining."
Bill Bryson's African Diary,Bill Bryson,"Bill Bryson goes to Kenya at the invitation of CARE International, the charity dedicated to working with local communities to eradicate poverty around the world. Kenya, generally regarded as the cradle of humankind, is a land of stunning landscapes, famous game reserves, and a vibrant culture, but it also has many serious problems, including refugees, AIDS, drought and grinding poverty. It also provides plenty to worry a nervous traveller like Bill Bryson: hair-raising rides in light aircraft, tropical diseases, snakes, insects and large predators. Bryson casts his inimitable eye on a continent new to him, and the resultant diary, though short in length, contains all his trademark laugh-out-loud wit, wry observation and curious insight. All the author’s royalties from this book, as well as all profits, will go to CARE International."
Bryson's Dictionary of Troublesome Words: A Writer's Guide to Getting It Right,Bill Bryson,"One of the English language's most skilled and beloved writers guides us all towards precise, mistake-free usage. In the middle 1980s Bill Bryson was a copy editor for the London Times with the brash idea that he could fill a hole in the British book market for a concise, accessible, handy guide to proper usage. A complete unknown, he nonetheless sold Penguin Books on the idea, and the result was The Penguin Dictionary of Troublesome Words, which sold decently enough on both sides of the Atlantic. Now, fifteen years later, Bill Bryson has become, well, Bill Bryson -- and his terrifically useful little book has been revised, updated and Americanized to become Bryson's Dictionary of Troublesome Words. Precise, prescriptive, sometimes (like its author) amusingly prickly, this book belongs on the desk of every person who cares enough about our language not to maul or misuse or distort it. Move over, Strunk and White."
In a Sunburned Country,Bill Bryson,"""I come from Des Moines. Somebody had to."" And, as soon as Bill Bryson was old enough, he left. Des Moines couldn't hold him, but it did lure him back. After ten years in England he returned to the land of his youth, and drove almost 14,000 miles in search of a mythical small town called Amalgam, the kind of smiling village where the movies from his youth were set. Instead he drove through a series of horrific burgs, which he renamed Smellville, Fartville, Coleslaw, Coma, and Doldrum. At best his search led him to Anywhere, USA, a lookalike strip of gas stations, motels and hamburger outlets populated by obese and slow-witted hicks with a partiality for synthetic fibres. He discovered a continent that was doubly lost: lost to itself because he found it blighted by greed, pollution, mobile homes and television; lost to him because he had become a foreigner in his own country."
I'm a Stranger Here Myself: Notes on Returning to America After Twenty Years Away,Bill Bryson,"A classic from the New York Times bestselling author of A Walk in the Woods and The Body. After living in Britain for two decades, Bill Bryson recently moved back to the United States with his English wife and four children (he had read somewhere that nearly 3 million Americans believed they had been abducted by aliens—as he later put it, ""it was clear my people needed me""). They were greeted by a new and improved America that boasts microwave pancakes, twenty-four-hour dental-floss hotlines, and the staunch conviction that ice is not a luxury item. Delivering the brilliant comic musings that are a Bryson hallmark, I'm a Stranger Here Myself recounts his sometimes disconcerting reunion with the land of his birth. The result is a book filled with hysterical scenes of one man's attempt to reacquaint himself with his own country, but it is also an extended if at times bemused love letter to the homeland he has returned to after twenty years away."
The Lost Continent: Travels in Small Town America,Bill Bryson,"""I come from Des Moines. Somebody had to."" And, as soon as Bill Bryson was old enough, he left. Des Moines couldn't hold him, but it did lure him back. After ten years in England he returned to the land of his youth, and drove almost 14,000 miles in search of a mythical small town called Amalgam, the kind of smiling village where the movies from his youth were set. Instead he drove through a series of horrific burgs, which he renamed Smellville, Fartville, Coleslaw, Coma, and Doldrum. At best his search led him to Anywhere, USA, a lookalike strip of gas stations, motels and hamburger outlets populated by obese and slow-witted hicks with a partiality for synthetic fibres. He discovered a continent that was doubly lost: lost to itself because he found it blighted by greed, pollution, mobile homes and television; lost to him because he had become a foreigner in his own country."
Neither Here nor There: Travels in Europe,Bill Bryson,"A classic from the New York Times bestselling author of A Walk in the Woods and The Body. After living in Britain for two decades, Bill Bryson recently moved back to the United States with his English wife and four children (he had read somewhere that nearly 3 million Americans believed they had been abducted by aliens—as he later put it, ""it was clear my people needed me""). They were greeted by a new and improved America that boasts microwave pancakes, twenty-four-hour dental-floss hotlines, and the staunch conviction that ice is not a luxury item. Delivering the brilliant comic musings that are a Bryson hallmark, I'm a Stranger Here Myself recounts his sometimes disconcerting reunion with the land of his birth. The result is a book filled with hysterical scenes of one man's attempt to reacquaint himself with his own country, but it is also an extended if at times bemused love letter to the homeland he has returned to after twenty years away."
Notes from a Small Island,Bill Bryson,"Before New York Times bestselling author Bill Bryson wrote The Road to Little Dribbling, he took this delightfully irreverent jaunt around the unparalleled floating nation of Great Britain, which has produced zebra crossings, Shakespeare, Twiggie Winkie’s Farm, and places with names like Farleigh Wallop and Titsey."
The Mother Tongue: English and How It Got That Way,Bill Bryson,"“Vastly informative and vastly entertaining…A scholarly and fascinating book.” —Los Angeles Times With dazzling wit and astonishing insight, Bill Bryson explores the remarkable history, eccentricities, resilience and sheer fun of the English language. From the first descent of the larynx into the throat (why you can talk but your dog can’t), to the fine lost art of swearing, Bryson tells the fascinating, often uproarious story of an inadequate, second-rate tongue of peasants that developed into one of the world’s largest growth industries."
J.R.R. Tolkien 4-Book Boxed Set: The Hobbit and The Lord of the Rings,J.R.R. Tolkien,"Tolkien's classic epic fantasy trilogy The Lord of the Rings, updated with a fresh new package forBook 3, The Return of the King As the Shadow of Mordor grows across the land, the Companions of the Ring have become involved in separate adventures. Aragorn, revealed as the hidden heir of the ancient Kings of the West, has joined with the Riders of Rohan against the forces of Isengard and takes part in the desperate victory of the Hornburg. Merry and Pippin, captured by Orcs, escape into Fangorn Forest and there encounter the Ents. Gandalf has miraculously returned and defeated the evil wizard, Saruman. Sam has left his master for dead after a battle with the giant spider, Shelob; but Frodo is still alive--now in the foul hands of the Orcs. And all the while the armies of the Dark Lord are massing as the One Ring draws ever nearer to the Cracks of Doom."
The Lord of the Rings (The Lord of the Rings  #1-3),J.R.R. Tolkien,Frodo the hobbit and a band of warriors from the different kingdoms set out to destroy the Ring of Power before the evil Sauron grasps control.
The Fellowship of the Ring (The Lord of the Rings  #1),J.R.R. Tolkien,Frodo the hobbit and a band of warriors from the different kingdoms set out to destroy the Ring of Power before the evil Sauron grasps control.
The Lord of the Rings (The Lord of the Rings  #1-3),J.R.R. Tolkien/Alan  Lee,Frodo the hobbit and a band of warriors from the different kingdoms set out to destroy the Ring of Power before the evil Sauron grasps control.
The Lord of the Rings: Weapons and Warfare,Chris   Smith/Christopher  Lee/Richard Taylor,"Describes in detail, with over one thousand photographs, the battles, armies, and armor used in the War of the Ring based on J.R.R. Tolkien's ""Lord of the Rings"" trilogy, including battle plans and character histories and descriptions."
The Lord of the Rings: Complete Visual Companion,Jude Fisher,"Photographs, screenshots, and images from all three films provide a visual compendium of the film trilogy ""The Lord of the Rings,"" documenting the varied characters and locales as seen through Peter Jackson's vision of Middle-earth."
Agile Web Development with Rails: A Pragmatic Guide,Dave Thomas/David Heinemeier Hansson/Leon Breedt/Mike Clark/Thomas  Fuchs/Andreas  Schwarz,"These are the proven, effective agile practices that will make you a better developer. You'll learn pragmatic ways of approaching the development process and your personal coding techniques. You'll learn about your own attitudes, issues with working on a team, and how to best manage your learning, all in an iterative, incremental, agile style. You'll see how to apply each practice, and what benefits you can expect. Bottom line: This book will make you a better developer."
Hatchet (Brian's Saga  #1),Gary Paulsen,"After a plane crash, thirteen-year-old Brian spends fifty-four days in the Canadian wilderness, learning to survive with only the aid of a hatchet given him by his mother, and learning also to survive his parents' divorce."
